{
    "$schema": "zone.schema.json",
    "map_type": 16,
    "npc_cache": 24,
    "area": 314,
    "matrix": 161,
    "scripts": 260,
    "text": 149,
    "bgm": "SEQ_BGM_C_08_B",
    "encounters": null,
    "enc_slot": 6,
    "entities": 143,
    "parent": "ZONE_OPELUCID_CITY",
    "place": 13,
    "place_display": 0,
    "weather": 0,
    "projection": 0,
    "camera": 0,
    "transition": 1,
    "battle_bg": 9,
    "cycling": false,
    "escape_rope": false,
    "fly_from": false,
    "cycle_surf_bgm": true,
    "entralink_warp": false,
    "cam_bound": 161,
    "name_icon": 15,
    "easy_level": 4,
    "fly": {
        "x": 5,
        "y": 0,
        "z": 4
    }
}
