{
    "$schema": "zone.schema.json",
    "map_type": 0,
    "npc_cache": 24,
    "area": 34,
    "matrix": 175,
    "scripts": 594,
    "text": 490,
    "bgm": "SEQ_BGM_GATE",
    "encounters": null,
    "enc_slot": 6,
    "entities": 453,
    "parent": "ZONE_CHARGESTONE_CAVE_GATE",
    "place": 85,
    "place_display": 1,
    "weather": 0,
    "projection": 1,
    "camera": 0,
    "transition": 0,
    "battle_bg": 7,
    "cycling": true,
    "escape_rope": false,
    "fly_from": false,
    "cycle_surf_bgm": false,
    "entralink_warp": false,
    "cam_bound": 175,
    "name_icon": 15,
    "easy_level": 0,
    "fly": {
        "x": 106,
        "y": 0,
        "z": 345
    }
}
