{
    "$schema": "zone.schema.json",
    "map_type": 0,
    "npc_cache": 24,
    "area": 380,
    "matrix": 310,
    "scripts": 1034,
    "text": 401,
    "bgm": "SEQ_BGM_SW_D_UMA",
    "encounters": null,
    "enc_slot": 6,
    "entities": 392,
    "parent": "ZONE_CAVE_OF_BEING",
    "place": 142,
    "place_display": 0,
    "weather": 0,
    "projection": 0,
    "camera": 0,
    "transition": 3,
    "battle_bg": 4,
    "cycling": false,
    "escape_rope": true,
    "fly_from": false,
    "cycle_surf_bgm": true,
    "entralink_warp": false,
    "cam_bound": 310,
    "name_icon": 15,
    "easy_level": 1,
    "fly": {
        "x": 5,
        "y": 0,
        "z": 4
    }
}
